{
  "$schema": "../schema/capability.schema.json",
  "version": "v1.0.0",
  "generatedAt": "2026-06-30T09:41:12.260Z",
  "canonicalSource": false,
  "canonicalSourcePath": "packages/contracts/src/operations/operation-registry.ts",
  "description": "Generated API and Operation Permission tool capability projection of packages/contracts/src/operations/operation-registry.ts. Do not edit this file by hand.",
  "capabilities": [
    {
      "id": "cap:api:readiness.baseline.status",
      "operationId": "readiness.baseline.status",
      "kind": "api",
      "risk": "read_only"
    },
    {
      "id": "cap:api:authorization.subject.resolve",
      "operationId": "authorization.subject.resolve",
      "kind": "api",
      "risk": "read_only"
    },
    {
      "id": "cap:api:authorization.policy.evaluate",
      "operationId": "authorization.policy.evaluate",
      "kind": "api",
      "risk": "read_only"
    },
    {
      "id": "cap:api:authorization.governance.summary",
      "operationId": "authorization.governance.summary",
      "kind": "api",
      "risk": "read_only"
    },
    {
      "id": "cap:api:authorization.organization_governance.get",
      "operationId": "authorization.organization_governance.get",
      "kind": "api",
      "risk": "read_only"
    },
    {
      "id": "cap:api:authorization.organization_governance.import",
      "operationId": "authorization.organization_governance.import",
      "kind": "api",
      "risk": "read_only"
    },
    {
      "id": "cap:api:authorization.organization_governance.preview",
      "operationId": "authorization.organization_governance.preview",
      "kind": "api",
      "risk": "read_only"
    },
    {
      "id": "cap:api:authorization.organization_governance.publish",
      "operationId": "authorization.organization_governance.publish",
      "kind": "api",
      "risk": "repair_write"
    },
    {
      "id": "cap:api:tag_management.tags.list",
      "operationId": "tag_management.tags.list",
      "kind": "api",
      "risk": "read_only"
    },
    {
      "id": "cap:api:tag_management.tags.get",
      "operationId": "tag_management.tags.get",
      "kind": "api",
      "risk": "read_only"
    },
    {
      "id": "cap:api:tag_management.tags.upsert",
      "operationId": "tag_management.tags.upsert",
      "kind": "api",
      "risk": "repair_write"
    },
    {
      "id": "cap:api:tag_management.tags.archive",
      "operationId": "tag_management.tags.archive",
      "kind": "api",
      "risk": "repair_write"
    },
    {
      "id": "cap:api:tag_management.tags.restore",
      "operationId": "tag_management.tags.restore",
      "kind": "api",
      "risk": "repair_write"
    },
    {
      "id": "cap:api:tag_management.projections.list",
      "operationId": "tag_management.projections.list",
      "kind": "api",
      "risk": "read_only"
    },
    {
      "id": "cap:api:tag_management.projections.rebuild",
      "operationId": "tag_management.projections.rebuild",
      "kind": "api",
      "risk": "repair_write"
    },
    {
      "id": "cap:api:tag_management.audit.list",
      "operationId": "tag_management.audit.list",
      "kind": "api",
      "risk": "read_only"
    },
    {
      "id": "cap:api:authorization.roles.list",
      "operationId": "authorization.roles.list",
      "kind": "api",
      "risk": "read_only"
    },
    {
      "id": "cap:api:authorization.roles.upsert",
      "operationId": "authorization.roles.upsert",
      "kind": "api",
      "risk": "repair_write"
    },
    {
      "id": "cap:api:authorization.departments.list",
      "operationId": "authorization.departments.list",
      "kind": "api",
      "risk": "read_only"
    },
    {
      "id": "cap:api:authorization.departments.upsert",
      "operationId": "authorization.departments.upsert",
      "kind": "api",
      "risk": "repair_write"
    },
    {
      "id": "cap:api:authorization.teams.list",
      "operationId": "authorization.teams.list",
      "kind": "api",
      "risk": "read_only"
    },
    {
      "id": "cap:api:authorization.teams.upsert",
      "operationId": "authorization.teams.upsert",
      "kind": "api",
      "risk": "repair_write"
    },
    {
      "id": "cap:api:authorization.users.policies.list",
      "operationId": "authorization.users.policies.list",
      "kind": "api",
      "risk": "read_only"
    },
    {
      "id": "cap:api:authorization.users.policy.upsert",
      "operationId": "authorization.users.policy.upsert",
      "kind": "api",
      "risk": "repair_write"
    },
    {
      "id": "cap:api:authorization.agent_groups.list",
      "operationId": "authorization.agent_groups.list",
      "kind": "api",
      "risk": "read_only"
    },
    {
      "id": "cap:api:authorization.agent_groups.upsert",
      "operationId": "authorization.agent_groups.upsert",
      "kind": "api",
      "risk": "repair_write"
    },
    {
      "id": "cap:api:authorization.agents.bindings.list",
      "operationId": "authorization.agents.bindings.list",
      "kind": "api",
      "risk": "read_only"
    },
    {
      "id": "cap:api:authorization.agents.binding.upsert",
      "operationId": "authorization.agents.binding.upsert",
      "kind": "api",
      "risk": "repair_write"
    },
    {
      "id": "cap:api:authorization.approvals.list",
      "operationId": "authorization.approvals.list",
      "kind": "api",
      "risk": "read_only"
    },
    {
      "id": "cap:api:authorization.approvals.upsert",
      "operationId": "authorization.approvals.upsert",
      "kind": "api",
      "risk": "repair_write"
    },
    {
      "id": "cap:api:authorization.approvals.revoke",
      "operationId": "authorization.approvals.revoke",
      "kind": "api",
      "risk": "repair_write"
    },
    {
      "id": "cap:api:authorization.receipts.list",
      "operationId": "authorization.receipts.list",
      "kind": "api",
      "risk": "read_only"
    },
    {
      "id": "cap:api:authorization.loan_records.list",
      "operationId": "authorization.loan_records.list",
      "kind": "api",
      "risk": "read_only"
    },
    {
      "id": "cap:api:authorization.denied_requests.list",
      "operationId": "authorization.denied_requests.list",
      "kind": "api",
      "risk": "read_only"
    },
    {
      "id": "cap:api:workspace.info",
      "operationId": "workspace.info",
      "kind": "api",
      "risk": "read_only"
    },
    {
      "id": "cap:api:workspace.file.upload",
      "operationId": "workspace.file.upload",
      "kind": "api",
      "risk": "safe_write"
    },
    {
      "id": "cap:api:workspace.file.list",
      "operationId": "workspace.file.list",
      "kind": "api",
      "risk": "read_only"
    },
    {
      "id": "cap:api:workspace.file.download",
      "operationId": "workspace.file.download",
      "kind": "api",
      "risk": "read_only"
    },
    {
      "id": "cap:api:workspace.file.read",
      "operationId": "workspace.file.read",
      "kind": "api",
      "risk": "read_only"
    },
    {
      "id": "cap:api:workspace.file.write",
      "operationId": "workspace.file.write",
      "kind": "api",
      "risk": "safe_write"
    },
    {
      "id": "cap:api:workspace.file.patch",
      "operationId": "workspace.file.patch",
      "kind": "api",
      "risk": "safe_write"
    },
    {
      "id": "cap:api:workspace.contribution.submit",
      "operationId": "workspace.contribution.submit",
      "kind": "api",
      "risk": "safe_write"
    },
    {
      "id": "cap:api:workspace.contribution.list",
      "operationId": "workspace.contribution.list",
      "kind": "api",
      "risk": "read_only"
    },
    {
      "id": "cap:api:workspace.contribution.leaderboard",
      "operationId": "workspace.contribution.leaderboard",
      "kind": "api",
      "risk": "read_only"
    },
    {
      "id": "cap:api:workspace.contribution.stats",
      "operationId": "workspace.contribution.stats",
      "kind": "api",
      "risk": "read_only"
    },
    {
      "id": "cap:api:workspace.contribution.report",
      "operationId": "workspace.contribution.report",
      "kind": "api",
      "risk": "read_only"
    },
    {
      "id": "cap:api:workspace.contribution.assets.list",
      "operationId": "workspace.contribution.assets.list",
      "kind": "api",
      "risk": "read_only"
    },
    {
      "id": "cap:api:workspace.contribution.permission.request",
      "operationId": "workspace.contribution.permission.request",
      "kind": "api",
      "risk": "safe_write"
    },
    {
      "id": "cap:api:workspace.contribution.permission.grant",
      "operationId": "workspace.contribution.permission.grant",
      "kind": "api",
      "risk": "repair_write"
    },
    {
      "id": "cap:api:workspace.contribution.scan",
      "operationId": "workspace.contribution.scan",
      "kind": "api",
      "risk": "safe_write"
    },
    {
      "id": "cap:api:workspace.contribution.review",
      "operationId": "workspace.contribution.review",
      "kind": "api",
      "risk": "safe_write"
    },
    {
      "id": "cap:api:workspace.contribution.preview",
      "operationId": "workspace.contribution.preview",
      "kind": "api",
      "risk": "safe_write"
    },
    {
      "id": "cap:api:workspace.contribution.publish",
      "operationId": "workspace.contribution.publish",
      "kind": "api",
      "risk": "repair_write"
    },
    {
      "id": "cap:api:workspace.contribution.adopt",
      "operationId": "workspace.contribution.adopt",
      "kind": "api",
      "risk": "safe_write"
    },
    {
      "id": "cap:api:workspace.contribution.reject",
      "operationId": "workspace.contribution.reject",
      "kind": "api",
      "risk": "repair_write"
    },
    {
      "id": "cap:api:workspace.contribution.request_changes",
      "operationId": "workspace.contribution.request_changes",
      "kind": "api",
      "risk": "safe_write"
    },
    {
      "id": "cap:api:recording_governance.policy.get",